file,comment,clean_comment
/content/pandas/pandas/io/html.py,# HTML spec: at most one of these lists has content,html spec at most one of these lists has content
/content/pandas/pandas/core/series.py,"# GH#13296 we are dealing with a compound dtype, which",gh we are dealing with a compound dtype which
/content/pandas/pandas/tests/scalar/timestamp/test_arithmetic.py,# no overflow expected,no overflow expected
/content/pandas/pandas/core/tools/numeric.py,# as float dtypes smaller than that are,as float dtypes smaller than that are
/content/pandas/pandas/tests/arithmetic/test_interval.py,# don't cast expected from BooleanArray to ndarray[object],dont cast expected from booleanarray to ndarrayobject
/content/pandas/pandas/core/internals/construction.py,"# We only need to copy arrays that will not get consolidated, i.e.",we only need to copy arrays that will not get consolidated ie
/content/pandas/pandas/tests/reshape/merge/test_join.py,"# _assert_same_contents(expected, expected2.loc[:, expected.columns])",assertsamecontentsexpected expectedloc expectedcolumns
/content/pandas/pandas/tests/series/test_arithmetic.py,# GH#52264 logical ops with dtype-less sequences deprecated,gh logical ops with dtypeless sequences deprecated
/content/requests/tests/test_lowlevel.py,# Verify server succeeded in authenticating.,verify server succeeded in authenticating
/content/pandas/pandas/tests/base/test_misc.py,# not using the all_arithmetic_functions fixture with _get_opstr,not using the allarithmeticfunctions fixture with getopstr
/content/pandas/pandas/core/series.py,"# default to [0], same as we would get with DataFrame(self)",default to  same as we would get with dataframeself
/content/pandas/pandas/tests/util/test_assert_numpy_array_equal.py,# see gh-20503,see gh
/content/pandas/pandas/core/ops/array_ops.py,# We don't catch tuple here bc we may be comparing e.g. MultiIndex,we dont catch tuple here bc we may be comparing eg multiindex
/content/pandas/pandas/tests/indexing/test_iat.py,# https://github.com/pandas-dev/pandas/issues/11754,httpsgithubcompandasdevpandasissues
/content/pandas/pandas/tests/config/test_config.py,# Ensure that creating a context does not affect the existing,ensure that creating a context does not affect the existing
/content/pandas/pandas/core/arrays/datetimelike.py,"# GH 3232: If the concat result is evenly spaced, we can retain the",gh  if the concat result is evenly spaced we can retain the
/content/pandas/pandas/tests/io/parser/test_network.py,"# 8 MB, S3FS uses 5MB chunks",mb sfs uses mb chunks
/content/pandas/pandas/io/common.py,"# be ""_IOWrapper | BaseBuffer"" [type-var]",be iowrapper  basebuffer typevar
/content/pandas/pandas/core/arrays/datetimelike.py,"# error: Unexpected keyword argument ""freq"" for ""_simple_new"" of ""NDArrayBacked""",error unexpected keyword argument freq for simplenew of ndarraybacked
/content/pandas/pandas/tests/frame/methods/test_astype.py,# this is the only real reason to do it this way,this is the only real reason to do it this way
/content/pandas/pandas/core/series.py,# We assume that the subclass __init__ knows how to handle a,we assume that the subclass init knows how to handle a
/content/pandas/doc/make.py,#!/usr/bin/env python3,usrbinenv python
/content/pandas/pandas/tests/base/test_misc.py,#  comparison semantics https://github.com/numpy/numpy/issues/15981,comparison semantics httpsgithubcomnumpynumpyissues
/content/pandas/pandas/core/reshape/melt.py,# TODO: anything else to catch?,todo anything else to catch
/content/pandas/pandas/__init__.py,# Pandas is not (yet) a py.typed library: the public API is determined,pandas is not yet a pytyped library the public api is determined
/content/pandas/pandas/tests/strings/test_cat.py,# errors for incorrect arguments in list-like,errors for incorrect arguments in listlike
/content/pandas/pandas/tests/indexes/categorical/test_map.py,# GH 31202 - override base class since we want to maintain categorical/ordered,gh   override base class since we want to maintain categoricalordered
/content/pandas/pandas/tests/extension/json/array.py,# on py38 builds it looks like numpy is inferring to a non-1D array,on py builds it looks like numpy is inferring to a nond array
/content/pandas/pandas/core/series.py,# DataFrame compatibility,dataframe compatibility
/content/pandas/pandas/core/arrays/datetimelike.py,# We got a StringArray,we got a stringarray
/content/pandas/pandas/tests/series/indexing/test_getitem.py,# GH#32684 a scalar key that is not recognized by lib.is_scalar,gh a scalar key that is not recognized by libisscalar
/content/pandas/pandas/tests/extension/base/ops.py,# EAs should return NotImplemented for ops with Series/DataFrame/Index,eas should return notimplemented for ops with seriesdataframeindex
/content/pandas/pandas/tests/indexes/test_common.py,# rename in place just leaves tuples and other containers alone,rename in place just leaves tuples and other containers alone
/content/pandas/pandas/tests/extension/test_sparse.py,# dataframes,dataframes
/content/pandas/pandas/core/generic.py,"# GH#21947 we have an empty DataFrame/Series, could be object-dtype",gh we have an empty dataframeseries could be objectdtype
/content/pandas/pandas/tests/reshape/merge/test_join.py,# generated an exception in 0.4.3,generated an exception in
/content/pandas/pandas/tests/tools/test_to_datetime.py,# https://github.com/pandas-dev/pandas/issues/12649,httpsgithubcompandasdevpandasissues
/content/pandas/pandas/tests/dtypes/test_missing.py,# type: ignore[call-overload],type ignorecalloverload
/content/pandas/pandas/io/html.py,# Better solution would be to use html5lib.,better solution would be to use htmllib
/content/pandas/pandas/tests/copy_view/test_methods.py,# changed to NOT update inplace because there is no benefit (actual,changed to not update inplace because there is no benefit actual
/content/pandas/pandas/tests/test_algos.py,# NumpyEADtype('complex128') => NumpyExtensionArray,numpyeadtypecomplex  numpyextensionarray
/content/pandas/pandas/core/generic.py,# create the tuple of the indexer,create the tuple of the indexer
/content/pandas/pandas/tests/series/test_logical_ops.py,# GH#9016: support bitwise op for integer types,gh support bitwise op for integer types
/content/pandas/pandas/tests/frame/test_query_eval.py,# https://github.com/pandas-dev/pandas/issues/22435,httpsgithubcompandasdevpandasissues
/content/pandas/pandas/tests/indexes/ranges/test_setops.py,# empty other,empty other
/content/pandas/pandas/core/sorting.py,# type: ignore[arg-type],type ignoreargtype
/content/pandas/pandas/tests/reshape/concat/test_append_common.py,# different dtype => not-category,different dtype  notcategory
/content/pandas/pandas/tests/io/pytables/test_compat.py,# the fixed format doesn't include categorical columns (not supported),the fixed format doesnt include categorical columns not supported
/content/pandas/pandas/core/dtypes/dtypes.py,# ordered=None.,orderednone
/content/pandas/pandas/tests/io/sas/test_sas7bdat.py,"# are returned as datetime.datetime, if this happens that whole chunk is returned",are returned as datetimedatetime if this happens that whole chunk is returned
/content/pandas/pandas/util/_print_versions.py,# needed for mypy,needed for mypy
/content/pandas/pandas/tests/indexes/test_common.py,# MultiIndex is tested separately,multiindex is tested separately
/content/pandas/pandas/core/arrays/datetimelike.py,"# disallow conversion between datetime/timedelta,",disallow conversion between datetimetimedelta
/content/pandas/pandas/tests/io/parser/test_python_parser_only.py,# We expect the third line in the data to be,we expect the third line in the data to be
/content/pandas/pandas/tests/io/pytables/test_file_handling.py,# invalid mode change,invalid mode change
/content/pandas/pandas/tests/frame/methods/test_round.py,# Default round to integer (i.e. decimals=0),default round to integer ie decimals
/content/pandas/pandas/tests/io/parser/test_na_values.py,# see gh-19227,see gh
/content/pandas/pandas/core/ops/array_ops.py,# numpy returned a scalar instead of operating element-wise,numpy returned a scalar instead of operating elementwise
/content/pandas/pandas/tests/dtypes/test_missing.py,# float/complex values that when viewed as int64 match iNaT,floatcomplex values that when viewed as int match inat
/content/pandas/pandas/tests/extension/base/ops.py,"# Subclasses are not expected to need to override check_opname, _check_op,",subclasses are not expected to need to override checkopname checkop
/content/pandas/pandas/tests/series/indexing/test_getitem.py,# see GH#13509,see gh
/content/pandas/pandas/tests/io/parser/test_c_parser_only.py,# fallback casting,fallback casting
/content/pandas/pandas/tests/reshape/merge/test_join.py,# Join on string value,join on string value
/content/pandas/pandas/io/pytables.py,# so delegate to the iterator,so delegate to the iterator
/content/pandas/pandas/io/sas/sas7bdat.py,"# Read a single unsigned integer of the given width (1, 2, 4 or 8).",read a single unsigned integer of the given width    or
/content/pandas/pandas/tests/config/test_config.py,# Formatter is none (default),formatter is none default
/content/pandas/doc/sphinxext/announce.py,"# authors, in current release and previous to current release.",authors in current release and previous to current release
/content/pandas/pandas/tests/copy_view/test_methods.py,# still shares memory (df2 is a shallow copy),still shares memory df is a shallow copy
/content/pandas/pandas/tests/dtypes/cast/test_promote.py,# filling anything with a string casts to object,filling anything with a string casts to object
/content/pandas/pandas/tests/copy_view/test_methods.py,# mutating df triggers a copy-on-write for the column / block,mutating df triggers a copyonwrite for the column  block
/content/pandas/pandas/tests/reshape/test_cut.py,# See https://github.com/pandas-dev/pandas/pull/56101#discussion_r1405325425,see httpsgithubcompandasdevpandaspulldiscussionr
/content/pandas/pandas/tests/tslibs/test_conversion.py,# localize_pydatetime,localizepydatetime
/content/pandas/pandas/core/interchange/from_dataframe.py,"# hold on to buffers, keeps memory alive",hold on to buffers keeps memory alive
/content/pandas/pandas/tests/util/test_assert_series_equal.py,# https://github.com/pandas-dev/pandas/issues/55882,httpsgithubcompandasdevpandasissues
/content/requests/tests/test_lowlevel.py,# release server block,release server block
/content/pandas/pandas/io/pytables.py,#  by the definition in index_cols.,by the definition in indexcols
/content/pandas/pandas/tests/io/parser/test_c_parser_only.py,# see gh-3453,see gh
/content/pandas/pandas/tests/io/test_orc.py,# FIXME: without casting to ns we do not round-trip correctly,fixme without casting to ns we do not roundtrip correctly
/content/pandas/pandas/io/parsers/python_parser.py,"# This was the first line of the file,",this was the first line of the file
/content/pandas/pandas/tests/window/test_timeseries_window.py,# to compare with a time-based roll,to compare with a timebased roll
/content/pandas/pandas/tests/tools/test_to_datetime.py,# extra columns,extra columns
/content/pandas/pandas/tests/scalar/timestamp/test_arithmetic.py,"# In particular, check that datetime64 - Timestamp works GH#28286",in particular check that datetime  timestamp works gh
/content/requests/tests/test_lowlevel.py,# Verify we haven't overwritten the location with our previous fragment.,verify we havent overwritten the location with our previous fragment
/content/pandas/pandas/tests/dtypes/test_concat.py,# concat_compat behavior on series._values should match pd.concat on series,concatcompat behavior on seriesvalues should match pdconcat on series
/content/pandas/pandas/tests/groupby/transform/test_numba.py,# TODO: Test more than just reductions (e.g. actually test transformations once we have,todo test more than just reductions eg actually test transformations once we have
/content/pandas/pandas/io/pytables.py,# ExtensionArrays (1d) may not have transpose.,extensionarrays d may not have transpose
/content/pandas/pandas/tests/dtypes/test_missing.py,"# identify check doesn't work for datetime64/timedelta64(""NaT"") bc they",identify check doesnt work for datetimetimedeltanat bc they
/content/pandas/pandas/io/json/_normalize.py,"# as pd.Dataframe(data) or pd.Dataframe(data, sep)",as pddataframedata or pddataframedata sep
/content/pandas/pandas/core/arrays/sparse/accessor.py,# a small overhead.,a small overhead
/content/pandas/pandas/tests/resample/test_resample_api.py,# non DatetimeIndex,non datetimeindex
/content/pandas/pandas/tests/reshape/test_cut.py,# see gh-19891,see gh
/content/pandas/asv_bench/benchmarks/pandas_vb_common.py,# causes an exception to be raised,causes an exception to be raised
/content/pandas/pandas/core/generic.py,# type: ignore[arg-type],type ignoreargtype
/content/pandas/pandas/tests/copy_view/test_methods.py,# function mutates the row object (which needs to trigger CoW if row is a view),function mutates the row object which needs to trigger cow if row is a view
/content/pandas/pandas/tests/test_algos.py,"# since factorize removes all NaNs, we do the same here",since factorize removes all nans we do the same here
/content/pandas/pandas/tests/indexing/test_chaining_and_caching.py,# TODO: Use tm.raises_chained_assignment_error() when PDEP-6 is enforced,todo use tmraiseschainedassignmenterror when pdep is enforced
/content/pandas/doc/sphinxext/announce.py,"# Homu is the author of auto merges, clean him out.",homu is the author of auto merges clean him out
/content/pandas/pandas/tests/series/test_arithmetic.py,# vs a cat-like,vs a catlike
/content/pandas/pandas/io/common.py,# open URLs,open urls
/content/pandas/pandas/tests/frame/methods/test_round.py,# Here's the test frame we'll be working with,heres the test frame well be working with
/content/pandas/pandas/core/computation/scope.py,# only look for locals in outer scope,only look for locals in outer scope
/content/pandas/pandas/tests/tools/test_to_datetime.py,# if we have ints/strings,if we have intsstrings
/content/pandas/pandas/tests/arrays/integer/test_function.py,# https://github.com/pandas-dev/pandas/issues/33317,httpsgithubcompandasdevpandasissues
/content/pandas/pandas/tests/series/methods/test_nlargest.py,# not supported on some archs,not supported on some archs
/content/pandas/pandas/io/parsers/python_parser.py,# use the EA's implementation of casting,use the eas implementation of casting
/content/pandas/pandas/tests/io/pytables/test_file_handling.py,# nested close,nested close
/content/pandas/pandas/core/computation/eval.py,"# ops.BinOp; for internal compat, not intended to be passed by users",opsbinop for internal compat not intended to be passed by users
/content/pandas/pandas/tests/reshape/concat/test_append_common.py,# cannot append non-index,cannot append nonindex
/content/pandas/pandas/tests/series/test_arithmetic.py,# interval dtype comparisons not yet implemented,interval dtype comparisons not yet implemented
/content/pandas/pandas/core/arrays/datetimelike.py,# Adding or subtracting a Timedelta/Timestamp scalar is freq-preserving,adding or subtracting a timedeltatimestamp scalar is freqpreserving
/content/pandas/pandas/tests/indexes/test_common.py,# should still fail even if it would be the right length,should still fail even if it would be the right length
/content/pandas/pandas/tests/copy_view/test_methods.py,# DataFrame methods returning new DataFrame using shallow copy,dataframe methods returning new dataframe using shallow copy
/content/pandas/pandas/tests/frame/methods/test_astype.py,"# We get the nearest supported unit, i.e. ""s""",we get the nearest supported unit ie s
/content/pandas/pandas/io/pytables.py,# GH#30962 needed by dask,gh needed by dask
/content/pandas/pandas/core/indexers/objects.py,# right endpoint is open,right endpoint is open
/content/pandas/pandas/core/generic.py,# Avoid converting to NaT,avoid converting to nat
/content/pandas/pandas/tests/io/parser/test_network.py,# can probably mock this though.,can probably mock this though
/content/pandas/pandas/tests/tools/test_to_datetime.py,# not enough,not enough
/content/pandas/pandas/_typing.py,# Shared by functions such as drop and astype,shared by functions such as drop and astype
/content/pandas/pandas/tests/window/test_expanding.py,# .loc is not preserving the names,loc is not preserving the names
/content/pandas/pandas/core/dtypes/dtypes.py,# find a better solution,find a better solution
/content/pandas/pandas/tests/scalar/timestamp/methods/test_tz_localize.py,# utc+1 -> utc+2,utc  utc
/content/pandas/pandas/core/series.py,"# Reindexing, sorting",reindexing sorting
/content/pandas/pandas/tests/io/sas/test_sas7bdat.py,# Test that pandas doesn't corrupt the numbers by adding,test that pandas doesnt corrupt the numbers by adding
/content/pandas/pandas/core/dtypes/dtypes.py,# e.g. int32 -> 32 bits // 8 = 4 bytes,eg int   bits     bytes
/content/pandas/pandas/core/arrays/datetimelike.py,# type: ignore[return-value],type ignorereturnvalue
/content/pandas/pandas/core/arrays/datetimelike.py,# Frequency Properties/Methods,frequency propertiesmethods
/content/requests/tests/test_lowlevel.py,# it had actual content (not checking for SOCKS protocol for now),it had actual content not checking for socks protocol for now
/content/pandas/pandas/core/arrays/datetimelike.py,# type: ignore[call-arg],type ignorecallarg
/content/pandas/pandas/core/internals/construction.py,"# figure out the index, if necessary",figure out the index if necessary
/content/pandas/pandas/tests/base/test_misc.py,# See gh-12238,see gh
/content/pandas/pandas/tests/groupby/methods/test_nth.py,# https://github.com/pandas-dev/pandas/issues/33071,httpsgithubcompandasdevpandasissues
/content/pandas/pandas/io/pytables.py,# create the table,create the table
/content/pandas/pandas/tests/series/test_logical_ops.py,# matches DataFrame behavior,matches dataframe behavior
/content/pandas/pandas/tests/window/test_timeseries_window.py,# not a valid freq,not a valid freq
/content/pandas/pandas/tests/extension/base/ops.py,# scalars don't support invert -> we don't expect the vectorized,scalars dont support invert  we dont expect the vectorized
/content/pandas/pandas/tests/arrays/test_datetimes.py,"# Like for getitem, if we are passed a naive-like string, we impute",like for getitem if we are passed a naivelike string we impute
/content/pandas/pandas/core/generic.py,# Note: obj.x will always call obj.__getattribute__('x') prior to,note objx will always call objgetattributex prior to
/content/pandas/pandas/io/common.py,# unchanged. using fsspec appears to break the ability to infer if the,unchanged using fsspec appears to break the ability to infer if the
/content/pandas/pandas/tests/io/parser/test_dialect.py,# No conflict,no conflict
/content/pandas/pandas/io/sas/sas_constants.py,# http://support.sas.com/documentation/cdl/en/etsug/60372/HTML/default/viewer.htm#etsug_intervals_sect009.htm,httpsupportsascomdocumentationcdlenetsughtmldefaultviewerhtmetsugintervalssecthtm
/content/pandas/pandas/tests/series/indexing/test_getitem.py,# not monotonic,not monotonic
/content/pandas/pandas/tests/reshape/merge/test_join.py,# smoke test,smoke test
/content/pandas/pandas/tests/io/json/test_ujson.py,# 8 is the max recursion depth,is the max recursion depth
/content/pandas/pandas/tests/reshape/test_qcut.py,# rounded to comparisons are a bit tricky.,rounded to comparisons are a bit tricky
/content/pandas/pandas/io/excel/_odfreader.py,# add blank rows to our table,add blank rows to our table
/content/pandas/pandas/tests/copy_view/test_methods.py,# Original is unchanged,original is unchanged
/content/pandas/pandas/core/generic.py,"# type ""dict[Literal['index', 'columns'], Callable[[Any], str]]""",type dictliteralindex columns callableany str
/content/pandas/pandas/tests/strings/test_cat.py,# add index of s for alignment,add index of s for alignment
/content/pandas/pandas/_typing.py,# To prevent import cycles place any internal imports in the branch below,to prevent import cycles place any internal imports in the branch below
/content/pandas/pandas/tests/extension/base/reduce.py,#  _get_expected_reduction_dtype. If you have a use case where this,getexpectedreductiondtype if you have a use case where this
/content/pandas/pandas/io/pytables.py,# find the axes,find the axes
/content/pandas/pandas/tests/frame/methods/test_rank.py,# see gh-15630.,see gh
/content/pandas/pandas/tests/series/methods/test_unique.py,# NAs in object arrays GH#714,nas in object arrays gh
/content/pandas/pandas/core/generic.py,"# error: Unsupported left operand type for - (""Type[NDFrame]"")",error unsupported left operand type for  typendframe
/content/pandas/pandas/io/pytables.py,# expected behaviour:,expected behaviour
/content/pandas/pandas/tests/io/sas/test_sas7bdat.py,# check: reader reads correct information,check reader reads correct information
/content/pandas/pandas/_typing.py,# converters,converters
/content/pandas/pandas/core/indexers/utils.py,"# allow a list_like, but exclude NamedTuples which can be indexers",allow a listlike but exclude namedtuples which can be indexers
/content/pandas/pandas/io/pytables.py,#  `c` below is a str.,c below is a str
/content/pandas/pandas/tests/groupby/methods/test_nth.py,# test multiple nth values,test multiple nth values
/content/pandas/pandas/core/arrays/datetimelike.py,# algorithms.factorize only passes sort=True here when freq is,algorithmsfactorize only passes sorttrue here when freq is
/content/pandas/pandas/tests/frame/methods/test_rank.py,# when values are intertwined with nan values.,when values are intertwined with nan values
/content/pandas/pandas/core/arrays/datetimelike.py,"# used for Timedelta/DatetimeArray, overwritten by PeriodArray",used for timedeltadatetimearray overwritten by periodarray
/content/pandas/pandas/tests/scalar/timestamp/methods/test_tz_localize.py,"# see gh-14621, GH#45087",see gh gh
/content/pandas/pandas/tests/reshape/test_cut.py,"# the dtype is inferred from ser, which has nanosecond unit",the dtype is inferred from ser which has nanosecond unit
/content/pandas/pandas/io/pytables.py,# check for column in the values conflicts,check for column in the values conflicts
/content/pandas/pandas/tests/arrays/sparse/test_arithmetics.py,# Ignore this if the actual op raises (e.g. pow).,ignore this if the actual op raises eg pow
/content/pandas/pandas/core/sorting.py,# sorter is index where elements ought to go,sorter is index where elements ought to go
/content/pandas/pandas/tests/config/test_localization.py,"# Once we exit the ""with"" statement, locale should be back to what it was.",once we exit the with statement locale should be back to what it was
/content/pandas/pandas/tests/indexes/datetimelike_/test_sort_values.py,# here with_freq refers to being period_range-like,here withfreq refers to being periodrangelike
/content/pandas/pandas/tests/arrays/sparse/test_combine_concat.py,# incompatible dtype -> Sparse[object] dtype,incompatible dtype  sparseobject dtype
/content/pandas/pandas/tests/io/parser/usecols/test_usecols_basic.py,# everything but the first case,everything but the first case
/content/pandas/pandas/io/common.py,"# python-zstandard defaults to text mode, but we always expect",pythonzstandard defaults to text mode but we always expect
/content/pandas/pandas/tests/config/test_config.py,# Test that option_context can be used as a decorator too (#34253).,test that optioncontext can be used as a decorator too
/content/pandas/pandas/io/parsers/python_parser.py,# that the list is not empty before proceeding.,that the list is not empty before proceeding
/content/pandas/pandas/tests/io/pytables/test_timezones.py,"# Single-tzinfo, no DST transition",singletzinfo no dst transition
/content/pandas/pandas/core/arrays/datetimelike.py,"# on type(self). For PeriodArray, it's Period (or stuff coercible",on typeself for periodarray its period or stuff coercible
/content/pandas/pandas/core/arrays/datetimelike.py,#  we retain that error message,we retain that error message
/content/pandas/pandas/tests/resample/test_resample_api.py,# make sure that we are consistent across,make sure that we are consistent across
/content/pandas/pandas/tests/extension/json/array.py,"# e.g. ""foo"" or 2.5",eg foo or
/content/pandas/pandas/core/generic.py,# all inputs have non-empty attrs,all inputs have nonempty attrs
/content/pandas/pandas/tests/test_algos.py,# Test not valid once order keyword is removed.,test not valid once order keyword is removed
/content/pandas/pandas/tests/tools/test_to_datetime.py,# out-of-bounds,outofbounds
/content/pandas/pandas/tests/extension/uuid/test_uuid.py,# Parts of ExtensionArray's essential API required for tests:,parts of extensionarrays essential api required for tests
/content/pandas/pandas/tests/extension/test_sparse.py,# this one looks doable.,this one looks doable
/content/pandas/pandas/tests/indexes/datetimes/methods/test_round.py,# test floor,test floor
/content/pandas/pandas/io/parsers/python_parser.py,# Apply NA values.,apply na values
/content/pandas/pandas/core/series.py,# type: ignore[assignment],type ignoreassignment
/content/pandas/pandas/tests/io/parser/test_c_parser_only.py,# This test case has a field too large for the Python parser / CSV library.,this test case has a field too large for the python parser  csv library
/content/pandas/pandas/io/common.py,"# Python <3.12, ZipExtFile has poor buffering that",python  zipextfile has poor buffering that
/content/pandas/pandas/tests/indexes/categorical/test_category.py,# long format,long format
/content/pandas/pandas/tests/frame/test_query_eval.py,# in/not in ops,innot in ops
/content/pandas/pandas/tests/dtypes/test_missing.py,# Check the handling of nested arrays in array_equivalent_object,check the handling of nested arrays in arrayequivalentobject
